{
  "schema_version": "0.6.0",
  "proposal_id": "claim-proposal.001",
  "mission_id": "mission.001",
  "protocol_branch_id": "protocol-branch.exploratory",
  "protocol_digest": null,
  "mode": "exploratory",
  "claim_type": "measurement",
  "proposition": "The synthetic architecture fixture conforms to its declared structural contract.",
  "scope": {
    "population": "synthetic architecture fixtures",
    "environment": "offline structural validation",
    "time": "2026-07-15",
    "intervention": "pinned schema validation",
    "exclusions": []
  },
  "estimand_ref": {
    "artifact_id": "estimand.001",
    "digest": "sha256:aaaaaaaaaaaaaaaaaaaaaaaaaaaaaaaaaaaaaaaaaaaaaaaaaaaaaaaaaaaaaaaa",
    "media_type": "application/json"
  },
  "consequence_rule_ref": {
    "method_id": "rule.claim-consequence",
    "version": "0.1.0",
    "registry_digest": "sha256:bbbbbbbbbbbbbbbbbbbbbbbbbbbbbbbbbbbbbbbbbbbbbbbbbbbbbbbbbbbbbbbb"
  },
  "falsifier_ids": [
    "falsifier.001"
  ],
  "exposure_at_creation": {
    "level": "full_outcome_exposure",
    "exposure_event_refs": [
      "event.exposure.001"
    ]
  },
  "created_at": "2026-07-15T09:00:00.000000Z",
  "created_by": {
    "principal_id": "researcher.001",
    "principal_type": "human"
  }
}
